[
  {
    "id": "S00",
    "owner": "release-manager",
    "action": "Collect fresh non-authorizing inventory at the seven immutable heads",
    "depends_on": [],
    "mode": "normal"
  },
  {
    "id": "S01",
    "owner": "release-manager",
    "action": "Obtain exact-hash council decision bound to spec, annex, spec-check and validator hashes",
    "depends_on": [
      "S00"
    ],
    "mode": "normal"
  },
  {
    "id": "B10",
    "owner": "release-manager",
    "action": "GET repository and require exact 404, then one-use dual-control private repository create",
    "depends_on": [
      "S01"
    ],
    "mode": "normal"
  },
  {
    "id": "B11",
    "owner": "independent-readback",
    "action": "Read repository numeric ID, node ID and settings independently",
    "depends_on": [
      "B10"
    ],
    "mode": "normal"
  },
  {
    "id": "B12",
    "owner": "release-manager",
    "action": "Commit exact approved seed and RepositoryBindingEnvelope",
    "depends_on": [
      "B11"
    ],
    "mode": "normal"
  },
  {
    "id": "B13",
    "owner": "independent-readback",
    "action": "Read exact seed Git tree and canonical blob bytes",
    "depends_on": [
      "B12"
    ],
    "mode": "normal"
  },
  {
    "id": "B14",
    "owner": "independent-readback",
    "action": "Read Apps, rulesets, environments and required checks",
    "depends_on": [
      "B13"
    ],
    "mode": "normal"
  },
  {
    "id": "B15",
    "owner": "administrator-readback",
    "action": "Read unredacted administrator-visible bypass actors",
    "depends_on": [
      "B14"
    ],
    "mode": "normal"
  },
  {
    "id": "CA20",
    "owner": "codicarium/codicarium-actions",
    "action": "Implement the bounded lane at the frozen base head",
    "depends_on": [
      "B15"
    ],
    "mode": "normal"
  },
  {
    "id": "CA21",
    "owner": "independent-reviewer",
    "action": "Sign exact-head and exact-diff review evidence",
    "depends_on": [
      "CA20"
    ],
    "mode": "normal"
  },
  {
    "id": "CA22",
    "owner": "independent-qa",
    "action": "Run positive tests and zero-effect negative oracles",
    "depends_on": [
      "CA21"
    ],
    "mode": "normal"
  },
  {
    "id": "CA23",
    "owner": "github-actions",
    "action": "Pass protected checks at the same candidate head",
    "depends_on": [
      "CA22"
    ],
    "mode": "normal"
  },
  {
    "id": "CA24",
    "owner": "guarded-merge",
    "action": "Merge the exact approved head without bypass",
    "depends_on": [
      "CA23"
    ],
    "mode": "normal"
  },
  {
    "id": "CA25",
    "owner": "independent-readback",
    "action": "Read post-merge main and successful protected CI",
    "depends_on": [
      "CA24"
    ],
    "mode": "normal"
  },
  {
    "id": "IF20",
    "owner": "codicarium/infra",
    "action": "Implement the bounded lane at the frozen base head",
    "depends_on": [
      "CA25"
    ],
    "mode": "normal"
  },
  {
    "id": "IF21",
    "owner": "independent-reviewer",
    "action": "Sign exact-head and exact-diff review evidence",
    "depends_on": [
      "IF20"
    ],
    "mode": "normal"
  },
  {
    "id": "IF22",
    "owner": "independent-qa",
    "action": "Run positive tests and zero-effect negative oracles",
    "depends_on": [
      "IF21"
    ],
    "mode": "normal"
  },
  {
    "id": "IF23",
    "owner": "github-actions",
    "action": "Pass protected checks at the same candidate head",
    "depends_on": [
      "IF22"
    ],
    "mode": "normal"
  },
  {
    "id": "IF24",
    "owner": "guarded-merge",
    "action": "Merge the exact approved head without bypass",
    "depends_on": [
      "IF23"
    ],
    "mode": "normal"
  },
  {
    "id": "IF25",
    "owner": "independent-readback",
    "action": "Read post-merge main and successful protected CI",
    "depends_on": [
      "IF24"
    ],
    "mode": "normal"
  },
  {
    "id": "PG20",
    "owner": "codicarium/postgres-config",
    "action": "Implement the bounded lane at the frozen base head",
    "depends_on": [
      "CA25"
    ],
    "mode": "normal"
  },
  {
    "id": "PG21",
    "owner": "independent-reviewer",
    "action": "Sign exact-head and exact-diff review evidence",
    "depends_on": [
      "PG20"
    ],
    "mode": "normal"
  },
  {
    "id": "PG22",
    "owner": "independent-qa",
    "action": "Run positive tests and zero-effect negative oracles",
    "depends_on": [
      "PG21"
    ],
    "mode": "normal"
  },
  {
    "id": "PG23",
    "owner": "github-actions",
    "action": "Pass protected checks at the same candidate head",
    "depends_on": [
      "PG22"
    ],
    "mode": "normal"
  },
  {
    "id": "PG24",
    "owner": "guarded-merge",
    "action": "Merge the exact approved head without bypass",
    "depends_on": [
      "PG23"
    ],
    "mode": "normal"
  },
  {
    "id": "PG25",
    "owner": "independent-readback",
    "action": "Read post-merge main and successful protected CI",
    "depends_on": [
      "PG24"
    ],
    "mode": "normal"
  },
  {
    "id": "VA20",
    "owner": "codicarium/vault-config",
    "action": "Implement the bounded lane at the frozen base head",
    "depends_on": [
      "CA25"
    ],
    "mode": "normal"
  },
  {
    "id": "VA21",
    "owner": "independent-reviewer",
    "action": "Sign exact-head and exact-diff review evidence",
    "depends_on": [
      "VA20"
    ],
    "mode": "normal"
  },
  {
    "id": "VA22",
    "owner": "independent-qa",
    "action": "Run positive tests and zero-effect negative oracles",
    "depends_on": [
      "VA21"
    ],
    "mode": "normal"
  },
  {
    "id": "VA23",
    "owner": "github-actions",
    "action": "Pass protected checks at the same candidate head",
    "depends_on": [
      "VA22"
    ],
    "mode": "normal"
  },
  {
    "id": "VA24",
    "owner": "guarded-merge",
    "action": "Merge the exact approved head without bypass",
    "depends_on": [
      "VA23"
    ],
    "mode": "normal"
  },
  {
    "id": "VA25",
    "owner": "independent-readback",
    "action": "Read post-merge main and successful protected CI",
    "depends_on": [
      "VA24"
    ],
    "mode": "normal"
  },
  {
    "id": "RP20",
    "owner": "codicarium/release-platform-config",
    "action": "Implement the bounded lane at the frozen base head",
    "depends_on": [
      "CA25"
    ],
    "mode": "normal"
  },
  {
    "id": "RP21",
    "owner": "independent-reviewer",
    "action": "Sign exact-head and exact-diff review evidence",
    "depends_on": [
      "RP20"
    ],
    "mode": "normal"
  },
  {
    "id": "RP22",
    "owner": "independent-qa",
    "action": "Run positive tests and zero-effect negative oracles",
    "depends_on": [
      "RP21"
    ],
    "mode": "normal"
  },
  {
    "id": "RP23",
    "owner": "github-actions",
    "action": "Pass protected checks at the same candidate head",
    "depends_on": [
      "RP22"
    ],
    "mode": "normal"
  },
  {
    "id": "RP24",
    "owner": "guarded-merge",
    "action": "Merge the exact approved head without bypass",
    "depends_on": [
      "RP23"
    ],
    "mode": "normal"
  },
  {
    "id": "RP25",
    "owner": "independent-readback",
    "action": "Read post-merge main and successful protected CI",
    "depends_on": [
      "RP24"
    ],
    "mode": "normal"
  },
  {
    "id": "DC20",
    "owner": "codicarium/deployment-controller",
    "action": "Implement the bounded lane at the frozen base head",
    "depends_on": [
      "CA25"
    ],
    "mode": "normal"
  },
  {
    "id": "DC21",
    "owner": "independent-reviewer",
    "action": "Sign exact-head and exact-diff review evidence",
    "depends_on": [
      "DC20"
    ],
    "mode": "normal"
  },
  {
    "id": "DC22",
    "owner": "independent-qa",
    "action": "Run positive tests and zero-effect negative oracles",
    "depends_on": [
      "DC21"
    ],
    "mode": "normal"
  },
  {
    "id": "DC23",
    "owner": "github-actions",
    "action": "Pass protected checks at the same candidate head",
    "depends_on": [
      "DC22"
    ],
    "mode": "normal"
  },
  {
    "id": "DC24",
    "owner": "guarded-merge",
    "action": "Merge the exact approved head without bypass",
    "depends_on": [
      "DC23"
    ],
    "mode": "normal"
  },
  {
    "id": "DC25",
    "owner": "independent-readback",
    "action": "Read post-merge main and successful protected CI",
    "depends_on": [
      "DC24"
    ],
    "mode": "normal"
  },
  {
    "id": "G30",
    "owner": "codicarium/infra",
    "action": "Materialize central capacity, Kata, namespaces, admission, proxy and RBAC",
    "depends_on": [
      "IF25"
    ],
    "mode": "normal"
  },
  {
    "id": "G31",
    "owner": "independent-qa",
    "action": "Run live infrastructure positive and zero-effect negative probes",
    "depends_on": [
      "G30"
    ],
    "mode": "normal"
  },
  {
    "id": "G32",
    "owner": "postgres-config+vault-config",
    "action": "Materialize CNPG, verify-full TLS and Vault bootstrap contracts",
    "depends_on": [
      "PG25",
      "VA25"
    ],
    "mode": "normal"
  },
  {
    "id": "G33",
    "owner": "independent-qa",
    "action": "Prove HA, RBAC, backup, isolated restore and any-node-loss RPO/RTO",
    "depends_on": [
      "G32"
    ],
    "mode": "normal"
  },
  {
    "id": "G34",
    "owner": "release-platform-config",
    "action": "Materialize release platform after infra, data, Vault and controller merge",
    "depends_on": [
      "RP25",
      "G31",
      "G33",
      "DC25"
    ],
    "mode": "normal"
  },
  {
    "id": "G35",
    "owner": "independent-qa",
    "action": "Prove successor is inert and has zero publication or activation effects",
    "depends_on": [
      "G34"
    ],
    "mode": "normal"
  },
  {
    "id": "X40",
    "owner": "independent-readback",
    "action": "Prove complete grant and Application set is absent",
    "depends_on": [
      "G35"
    ],
    "mode": "normal"
  },
  {
    "id": "X41",
    "owner": "release-platform-config",